"|aThe Hatfield SCT lunar atlas|h[cartographic material] :|bphotographic atlas for Meade, Celestron, and other SCT telescopes ; with 216 figures /|cJeremy Cook |aCook, Jeremy,|d1933-"
"|aMaps showing geology, oil and gas fields and geologic provinces of the Asia Pacific Region|h[electronic resource] /|cU.S. Department of the Interior, U.S. Geological Survey ; compiled by Douglas W. Steinshouer ... [et al] |aGeological Survey (U.S.)"
"|aWater levels in, extent of freshwater in, and water withdrawals from ten confined aquifers, New Jersey and Delaware coastal plain, 1998 /|cU.S. Department of the Interior, U.S. Geological Survey ; prepared in cooperation with the New Jersey Department of Environmental Protection ; by Pierre J. Lacombe and Robert Rosman |aGeological Survey (U.S.)"
"|aWorld ocean atlas, 2001|h[electronic resource] :|bobjectively analyzed fields and statistics /|cprepared by the Ocean Climate Laboratory, National Oceanographic Data Center |aNational Oceanographic Data Center (U.S.).|bOcean Climate Laboratory"
"|aLandView 5 on DVD|h[electronic resource] :|ba viewer for EPA, Census and USGS data and maps /|cproduced by U.S. Environmental Protection Agency, U.S. Census Bureau, U.S. Geological Survey, National Oceanic and Atmospheric Administration |aU.S. Census Bureau"
|aAfrica |aUnited States.|bCentral Intelligence Agency |a[Relief ed.]
"|aLouisiana ground-water map no. 14 :|bpotentiometric surface, January 2001, and water-level changes, June 2000 to January 2001, of the Chicot Aquifer system in southwestern Louisiana /|cU.S. Department of the Interior, U.S. Geological Survey ; prepared in cooperation with the Louisiana State University Agricultural Center, Cooperative Extension Service and the Louisiana Rice Research Board ; by John K. Lovelace, Jared W. Fontenot, and C. Paul Frederick |aGeological Survey (U.S.)"
"|aPreliminary digital geologic map of the Penokean (early Proterozoic) continental margin in northern Michigan and Wisconsin|h[electronic resource] /|cby Cannon, W.F. and Ottke, D |aCannon, William F"
|aCommonwealth of Independent States|h[cartographic material] |aUnited States.|bCentral Intelligence Agency
"|aMap showing geology, oil and gas fields, and geologic provinces of Iran|h[electronic resource] /|cU.S. Department of the Interior, U.S. Geological Survey ; compiled by R.M. Pollastro, F.M. Persits, and D.W. Steinshouer ; CD-ROM implementation by B.S. Larson |aGeological Survey (U.S.) |aVersion 1.0"
|aBurma (Myanma)|h[cartographic material] |aUnited States.|bCentral Intelligence Agency |a[Relief ed.]
|aChina|h[cartographic material] |aUnited States.|bCentral Intelligence Agency
|aUganda |aUnited States.|bCentral Intelligence Agency |a[Planimetric ed.]
"|aAtlas of Mercury /|cprepared for the Office of Space Sciences, National Aeronautics and Space Administration ; authors and editors, Merton E. Davies ... [et. al.]"
"|aGeologic cross section E-E' through the Appalachian Basin from the Findlay Arch, Wood County, Ohio, to the Valley and Ridge Province, Pendleton County, West Virginia /|cby Robert T. Ryder ... [et al.] ; U.S. Department of the Interior, U.S. Geological Survey"
|aSouth America |aUnited States.|bCentral Intelligence Agency |a[Relief ed.]
"|aDigital data grids for the Magnetic anomaly map of North America|h[electronic resource] /|cNorth American Magnetic Anomaly Group (NAMAG), Viki Bankey ... [et al.] ; U.S. Department of the Interior, U.S. Geological Survey |aNorth American Magnetic Anomaly Group |aVersion 1.0"
|aDigital aeromagnetic datasets for the conterminous United States and Hawaii|h[electronic resource] :|ba companion to the North American magnetic anomaly map /|cby U.S. Geological Survey and National Geophysical Data Center |aGeological Survey (U.S.)
"|aGeology of the Chesapeake and Ohio Canal National Historical Park and Potomac River Corridor, District of Columbia, Maryland, West Virginia, and Virginia|h[electronic resource] /|cby C. Scott Southworth ... [et al.] ; U.S. Department of the Interior, U.S. Geological Survey ; prepared in cooperation with the National Park Service ... [et al.] |aGeological Survey (U.S.)"
"|aLouisiana ground-water map no. 13|h[cartographic material] :|bhydrogeologic and potentiometric surface, October 1996, of the Sparta Aquifer in northern Louisiana /|cby Jeffrey A. Brantly, Ronald C. Seanor, and Kaycee L. McCoy ; U.S. Department of the Interior, U.S. Geological Survey ; prepared in cooperation with the Louisiana Department of Transportation and Development, Public Works and Water Resources Division, Water Resources Section |aGeological Survey (U.S.)"
"|aDigital aeromagnetic data and derivative products from a helicopter survey over the town of Taos and surrounding areas, Taos County, New Mexico|h[electronic resource] /|cby Viki Bankey, V.J.S. Grauch, and Fugro Airborne Surveys Corporation |aBankey, Viki"
"|aTime of travel of solutes in Buffalo Bayou and selected tributaries, Houston, Texas, August 1999 /|cU.S. Department of the Interior, U.S. Geological Survey ; by Jeffery W. East and Jasper D. Schaer ; prepared in cooperation with the U.S. Environmental Protection Agency |aGeological Survey (U.S.)"
|aPrototype data for GLOBE|h[electronic resource] :|b(global land one-km base elevation) |aVersion 0.5
|aHong Kong and vicinity|h[cartographic material] |aUnited States.|bCentral Intelligence Agency |a[Political ed.]
"|aPreliminary lithogeochemical map showing near-surface rock types in the Chesapeake Bay Watershed, Virginia and Maryland|h[electronic resource] : /|cby John D. Peper ... [et al.] ; in cooperation with the Virginia Division of Mineral Resources and the Maryland Geological Survey |aGeological Survey (U.S.) |aVersion 1.0"
|aA Gap Analysis of Kentucky|h[electronic resource] :|bJuly 2003 final report
|aSoutheast Asia |aUnited States.|bCentral Intelligence Agency
|aItaly |aUnited States.|bCentral Intelligence Agency |a[Relief ed.]
|aItaly |aUnited States.|bCentral Intelligence Agency |a[Planimetric ed.]
"|aBeach structures map series of West-Central Florida|h[electronic resource] /|cby Guy Gelfenbaum, Kristy Guy, and Kevin Geraghty |aGelfenbaum, Guy"
"|aMaps showing sea floor topography, sun-illuminated sea floor topography, and backscatter intensity of quadrangles 1 and 2 in the Great South Channel Region, Western Georges Bank|h[electronic resource] /|cPage C. Valentine, editor ; prepared in cooperation with the National Oceanic and Atmospheric Administration |aVersion 1.0"
|aIran|h[cartographic material] |aUnited States.|bCentral Intelligence Agency |a[Relief ed.]
|aBosnia and Herzegovina|h[cartographic material] |aUnited States.|bCentral Intelligence Agency
|aThe disputed area of Kashmir|h[cartographic material] |aUnited States.|bCentral Intelligence Agency
|aAntarctic region|h[cartographic material] |aUnited States.|bCentral Intelligence Agency
|aSaint Kitts and Nevis|h[cartographic material] |aUnited States.|bCentral Intelligence Agency
"|aMaps showing geology, oil and gas fields, and geologic provinces of South America|h[electronic resource] /|cU.S. Department of the Interior, U.S. Geological Survey ; compiled by Christopher J. Schenk, Roland J. Viger, and Christopher P. Anderson |aGeological Survey (U.S.)"
|aZimbabwe|h[cartographic material] |aUnited States.|bCentral Intelligence Agency
"|aMap showing geology, oil and gas fields and geologic provinces of the former Soviet Union|h[electronic resource] /|cU.S. Department of the Interior, U.S. Geological Survey ; by F.M. Persits, G.F. Ulmishek, and D.W. Steinshouer |aGeological Survey (U.S.)"
"|aGeology of the Mount Le Conte 7.5-minute quadrangle, Great Smoky Mountains National Park, Tennessee and North Carolina|h[electronic resource] /|cU.S. Department of the Interior, U.S. Geological Survey ; by Art Schultz ... [et al.] ; prepared in cooperation with the National Park Service |aGeological Survey (U.S.)"
"|aNatural hazards map of the Circum-Pacific region, Pacific basin sheet /|cCircum-Pacific Map Project ; Circum-Pacific Council for Energy and Mineral Resources ; map production by U.S. Geological Survey ; cartography by Frank J. Sidlauskas |aCircum-Pacific Map Project"
|aSouth Africa |aUnited States.|bCentral Intelligence Agency |a[Planimetric ed.]
"|aMotor vehicle use map.|pSandia Ranger District, Cibola National Forest, New Mexico /|cForest Service, United States Department of Agriculture |aUnited States.|bForest Service,|ecartographer"
|aSerbia and Montenegro |aUnited States.|bCentral Intelligence Agency |a[Planimetric ed.]
|aVietnam|h[cartographic material] |aUnited States.|bCentral Intelligence Agency |a[Relief ed.]
|aJapan|h[cartographic material] :|badministrative divisions |aUnited States.|bCentral Intelligence Agency |a[Political ed.]
"|aHawaii's volcanoes revealed /|h[cartographic material] /|cby Barry W. Eakins ... [et al.] ; prepared in cooperation with the Japan Marine Science and Technology Center, University of Hawai?i, School of Ocean and Earth Science and Technology, and the Monterey Bay Aquarium Research Institute |aGeological Survey (U.S.)"
"|aGeologic map of the Mound Spring quadrangle, Nye and Clark counties, Nevada, and Inyo County, California|h[electronic resource] /|cby Scott C. Lundstrom ... [et al.] ; U.S. Department of the Interior, U.S. Geological Survey ; prepared in cooperation with the Nye County Nuclear Waste Repository Project Office |aVersion 1.0"
"|aTopographic map of the western region of Dao Vallis in Hellas Planitia, Mars, MTM 500k -40/082E OMKT|h[electronic resource] /|cby Mark R. Rosiek, Bonnie L. Redding, and Donna M. Galuszka ; U.S. Department of the Interior, U.S. Geological Survey |aRosiek, Mark R.|q(Mark Robert),|d1957- |aVersion 1.0"
"|aBiological atlas of the Arctic seas 2000|h[electronic resource] :|bplankton of the Barents and Kara seas /|cMurmansk Marine Biological Institute ; Ocean Climate Laboratory, National Oceanographic Data Center/NOAA"
|aLaos|h[cartographic material] |aUnited States.|bCentral Intelligence Agency |a[Relief ed.]
"|aSeaside, Oregon, tsunami pilot study|h[electronic resource] :|bmodernization of FEMA flood hazard maps, GIS data /|cby Florence L. Wong, Angie J. Venturato, and Eric L. Geist"
|aA Gap analysis of Kansas|h[electronic resource] :|bAugust 2002 final report
|aCôte d'Ivoire |aUnited States.|bCentral Intelligence Agency |a[Planimetric ed.]
"|aMining claim activity on federal land for the period 1976 through 2003|h[electronic resource] /|cby J. Douglas Causey ; U.S. Department of the Interior, U.S. Geological Survey |aCausey, J. Douglas |aVersion 1.0"
|aGuinea|h[cartographic material] |aUnited States.|bCentral Intelligence Agency
|aA Gap analysis of Maine|h[electronic resource] :|bOctober 1998 final report
|aJamaica|h[cartographic material] |aUnited States.|bCentral Intelligence Agency
"|aHydrology of the unconfined aquifer system, Rancocas Creek area, Rancocas, Crosswicks, Assunpink, Blacks, and Crafts Creek Basins, New Jersey /|cby Martha K. Watt ... [et al.] ; U.S. Department of the Interior, U.S. Geological Survey ; prepared in cooperation with the New Jersey Department of Environmental Protection"
"|aDigital files for northeast Asia geodynamics, mineral deposit location, and metallogenic belt maps, stratigraphic columns, descriptions of map units, and descriptions of metallogenic belts|h[electronic resource] /|cU.S. Department of the Interior, U.S. Geological Survey ;  edited by Warren J. Nokleberg ... [et al.] ;  prepared in collaboration with Russian Academy of Sciences ... [et al.] |aGeological Survey (U.S.) |aVersion 1.0"
|aSouth Africa|h[cartographic material] |aUnited States.|bCentral Intelligence Agency
|aSouth Asia|h[cartographic material] |aUnited States.|bCentral Intelligence Agency
|aAfghanistan|h[cartographic material] |aUnited States.|bCentral Intelligence Agency |a[Relief ed.]
"|aEmergency preparedness atlas :|bU.S. nursing home and hospital facilities /|cprepared by Elisabeth D. Root ... [et al.] ; prepared for Agency for Healthcare Research and Quality, U.S. Department of Health and Human Services"
"|aHydrogeology of Webb County, Texas /|cby Rebecca B. Lambert ; U.S. Department of the Interior, U.S. Geological Survey ; in cooperation with the City of Laredo |aLambert, Rebecca B"
|aA Gap analysis of Missouri|h[electronic resource] :|bJune 2002 final report
|aA Gap analysis of Arkansas|h[electronic resource] :|bJune 1998 final report
"|aGeologic map of the Van Buren South quadrangle, Carter County, Missouri /|h[cartographic material] /|cU.S. Department of the Interior, U.S. Geological Survey ; by David J.  Weary and J. Stephen Schindler |aGeological Survey (U.S.)"
"|aThickness of the Mississippi River alluvium and thickness of the coarse sand and gravel in the Mississippi River alluvium in northwestern Mississippi|h[cartographic material] /|cU.S. Department of the Interior, U.S. Geological Survey ; by J. Kerry Arthur and Eric W. Strom ; prepared in cooperation with the Mississippi Department of Environmental Quality, Office of Land and Water Resources |aGeological Survey (U.S.)"
"|aGIS surface effects archive of underground nuclear detonations contucted [sic] at Yucca Flat and Pahute Mesa, Nevada Test Site, Nevada|h[electronic resource] /|cby Dennis N. Grasso ; U.S. Dept. of the Interior, U.S. Geological Survey |aGrasso, Dennis N |aVersion 1.0"
|aA Gap analysis of Washington|h[electronic resource] :|bSeptember 1997 final report
|aA Gap analysis of Florida|h[electronic resource] :|bJune 2001 final report
|aCentral Balkan region|h[cartographic material] |aUnited States.|bCentral Intelligence Agency
"|aDigital aeromagnetic data and derivative products from a helicopter survey over the town of Blanca and surrounding areas, Alamosa and Costilla Counties, Colorado|h[electronic resource] /|cby Viki Bankey, V.J.S. Grauch, and Fugro Airborne Surveys Corporation |aBankey, Viki |aVersion 1.0"
"|aHydrologic resources of Guam /|cU.S. Department of the Interior, U.S. Geological Survey ; by Stephen B. Gingerich ; prepared in cooperation with the Water and Environmental Research Institute (WERI), University of Guam |aGeological Survey (U.S.)"
|aLiberia |aUnited States.|bCentral Intelligence Agency |a[Planimetric ed.]
"|aAtlas of cancer mortality in the United States, 1950-94|h[cartographic material] /|cSusan S. Devesa ... [et al.]"
|aFinland|h[cartographic material] |aUnited States.|bCentral Intelligence Agency |a[Relief ed.]
"|aGeologic map database of the Washington DC area, featuring data from three 30 x 60 minute quadrangles, Frederick, Washington West, and Fredericksburg|h[electronic resource] /|cU.S. Department of the Interior, U.S. Geological Survey ; compilation and design by Adam M. Davis ... [et al.] |aGeological Survey (U.S.)"
"|aBackscatter intensity, shaded relief, and sea floor topography of quadrangle 2 in western Massachusetts Bay offshore of Boston, Massachusetts /|h[cartographic material] /|cU.S. Department of the Interior, U.S. Geological Survey ; by Bradford Butman ... [et al.] |aGeological Survey (U.S.)"
"|aGeologic map of the Salmon National Forest and vicinity, east-central Idaho|h[cartographic material] /|cU.S. Department of the Interior, U.S. Geological Survey ; compiled by Karl V. Evans and Gregory N. Green |aGeological Survey (U.S.)"
|aSouthwest Asia|h[cartographic material] |aUnited States.|bCentral Intelligence Agency
|aSlovenia|h[cartographic material] |aUnited States.|bCentral Intelligence Agency |a[Relief ed.]
"|aAtlas of relations between climatic parameters and distributions of important trees and shrubs in North America /|cby Robert S. Thompson, Katherine H. Anderson, and Patrick J. Bartlein |aThompson, Robert Stephen"
|aIndonesia|h[cartographic material] |aUnited States.|bCentral Intelligence Agency
"|aPeru, administrative divisions |aUnited States.|bCentral Intelligence Agency"
"|aLandView 6 on DVD|h[electronic resource] :|ba viewer for EPA, Census Bureau, USGS data and maps /|cproduced by U.S. Environmental Protection Agency, U.S. Census Bureau, U.S. Geological Survey, National Oceanic and Atmospheric Administration |aU.S. Census Bureau"
|aDenmark|h[cartographic material] |aUnited States.|bCentral Intelligence Agency |a[Political ed.]
"|aHazpac|h[electronic resource] :|ban interactive map of Pacific Rim natural hazards, population, and infrastructure /|cby Brynn L. Bemis ... [et al.] ; U.S. Department of the Interior, U.S. Geological Survey ; prepared in cooperation with American Red Cross, Circum-Pacific Council, and Stanford University |aBemis, Brynn L |aVersion 1.0"
|aA Gap analysis of South Carolina|h[electronic resource] :|b2001 final report
|aIraq |aUnited States.|bCentral Intelligence Agency |a[Relief ed.]
|aKashmir region|h[cartographic material] |aUnited States.|bCentral Intelligence Agency |a[Relief ed.]
|aCape Verde |aUnited States.|bCentral Intelligence Agency |a[Relief ed.]
"|aGeologic map of the Hogback Mountain quadrangle, Lewis and Clark and Meagher counties, Montana /|h[cartographic material] /|cU.S. Department of the Interior, U.S. Geological Survey ; by Mitchell W. Reynolds |aGeological Survey (U.S.)"
"|aMaps showing geology, oil and gas fields, and geologic provinces of the Arctic|h[electronic resource] /|ccompiled by Feliks M. Persits and Gregory F. Ulmishek ; U.S. Department of the Interior, U.S. Geological Survey |aGeological Survey (U.S.) |aVersion 1.0"
|aA Gap analysis of Idaho|h[electronic resource] :|bAugust 2002 final report
"|aCoastal-change and glaciological map of the Ronne Ice Shelf area, Antarctica, 1974-2002 /|cby Jane G. Ferrigno ... [et al.] ; U.S. Department of the Interior, U.S. Geological Survey ; prepared in cooperation with the Scott Polar Research Institute, University of Cambridge, United Kingdom"
"|aGeologic map of the Tower Peak quadrangle, central Sierra Nevada, California /|h[cartographic material] /|cby Clyde Wahrhaftig ; U.S. Department of the Interior, U.S. Geological Survey |aGeological Survey (U.S.)"
|aThe North Dakota GAP analysis project|h[electronic resource] :|breport
"|aSurficial geologic map of the Tanacross B-6 quadrangle, east-central Alaska|h[electronic resource] /|cU.S. Department of the Interior, U.S. Geological Survey ; by Paul E. Carrara |aGeological Survey (U.S.)"
"|aMosquito Lake fishing map /|h[cartographic material] /|cDivision of Wildlife, Ohio Department of Natural Resources |a[Rev.]"
"|aPredevelopment water-level map of the Santa Fe Group aquifer system in the middle Rio Grande Basin between Cochiti Lake and San Acacia, New Mexico /|cU.S. Department of the Interior, U.S. Geological Survey ; by Laura M. Bexfield and Scott K. Anderholm ; prepared in cooperation with the City of Albuquerque |aGeological Survey (U.S.)"
"|aCoastal-change and glaciological map of the Trinity Peninsula area and South Shetland Islands, Antarctica, 1843-2001 /|h[cartographic material] /|cby Jane G. Ferrigno ... [et al.] ; U.S. Department of the Interior, U.S. Geological Survey ; prepared in cooperation with the British Antarctic Survey, Scott Polar Research Institute, [and] Bundesamt für Kartographie und Geodäsie |aGeological Survey (U.S.)"
"|aGeologic map of the Sedan quadrangle, Gallatin and Park Counties, Montana /|cby Betty Skipp, D.R. Lageson, and W.J. McMannis |aSkipp, Betty,|d1928- |aVersion 2.1"
|aBurundi|h[cartographic material] |aUnited States.|bCentral Intelligence Agency |a[Relief ed.]
|aA Gap analysis of Southern New England|h[electronic resource] :|bApril 2004 final report and data /|cproduced by the National Gap Analysis Office
|aIndia|h[cartographic material] |aUnited States.|bCentral Intelligence Agency
|aZambia|h[cartographic material] |aUnited States.|bCentral Intelligence Agency |a[Relief ed.]
|aBelize |aUnited States.|bCentral Intelligence Agency
"|aBedrock geologic map of the Hubbard Brook Experimental Forest, Grafton County, New Hampshire|h[electronic resource] /|cby William C. Burton, Gregory J. Walsh, and Thomas R. Armstrong ; U.S. Department of the Interior, U.S. Geological Survey |aBurton, William C.|q(William Chapin),|d1952-"
|aEcoregions of Oklahoma |aGeological Survey (U.S.)
"|aHigh-resolution Quaternary seismic stratigraphy of the New York Bight continental shelf|h[electronic resource] /|cby Schwab, W.C. ... [et al.] ; U.S. Department of the Interior, U.S. Geological Survey"
|aEast Timor|h[cartographic material] |aUnited States.|bCentral Intelligence Agency
|aA Gap analysis of Montana|h[electronic resource] :|bSeptember 1998 final report
|aCommonwealth of Independent States--Central Asian states|h[cartographic material] |aUnited States.|bCentral Intelligence Agency
"|aBenthic habitats of the main Hawaiian Islands :|binterim product 2003 /|cCenter for Coastal Monitoring and Assessment, Biogeography Program"
|aNorway|h[cartographic material] |aUnited States.|bCentral Intelligence Agency
|aEthiopia|h[cartographic material] |aUnited States.|bCentral Intelligence Agency |a[Relief ed.]
|aNew Zealand administrative divisions |aUnited States.|bCentral Intelligence Agency
"|aMap showing Quaternary geology and geomorphology of the Granite Park area, Grand Canyon, Arizona /|h[cartographic material] /|cby Richard Hereford, Kelly J. Burke, and Kathryn S. Thompson ; U.S. Department of the Interior, U.S. Geological Survey ; prepared in cooperation with the U.S. Bureau of Reclamation, Glen Canyon Environmental Studies |aGeological Survey (U.S.)"
|aNorth Korea |aUnited States.|bCentral Intelligence Agency
"|aPreliminary digital geologic map of the Appalachian Piedmont and Blue Ridge, South Carolina segment|h[electronic resource] /|cby J. Wright Horton, Jr. and Connie L. Dicken |aHorton, J. Wright"
|aThailand administrative divisions |aUnited States.|bCentral Intelligence Agency
"|aBeaufort Sea coastal erosion, sediment flux, shoreline evolution, and the erosional shelf profile /|h[cartographic material] /|cDepartment of the Interior, U.S. Geological Survey ; by Erk Reimnitz, Scot M. Graves, and Peter W. Barnes |aGeological Survey (U.S.)"
"|aSea floor topographic map and perspective-view imagery of quadrangles 1-18, Stellwagen Bank National Marine Sanctuary off Boston, Massachusetts|h[electronic resource] /|cU.S. Geological Survey ; prepared in cooperation with the National Oceanic and Atmospheric Administration; by Page C. Valentine ... [et al.] |aGeological Survey (U.S.)"
"|aA Gap analysis of the land cover in Maryland, Delaware, and New Jersey|h[electronic resource] :|b2003 final report and data"
|aNorth America|h[cartographic material] |aUnited States.|bCentral Intelligence Agency
"|aGeologic map of the Grand Canyon 30? x 60? quadrangle, Coconino and Mohave Counties, northwestern Arizona|h[cartographic material] /|cU.S. Department of the Interior, U.S. Geological Survey ; by George H. Billingsley |aGeological Survey (U.S.) |aVersion 1.0"
|aCentral Balkan region |aUnited States.|bCentral Intelligence Agency
"|aAño Nuevo to Santa Cruz, California|h[electronic resource] :|ba photographic tour of the coastline /|cby Henry Chezar and Florence L. Wong |aChezar, Henry |aVersion 1.0"
"|aDigital representation of a map showing the thickness and character of Quaternary sediments in the glaciated United States east of the Rocky Mountains|h[electronic resource] /|cU.S. Department of the Interior, U.S. Geological Survey ; by David R. Sollar and Patricia H. Packard |aGeological Survey (U.S.)"
"|aGeology of the conterminous United States at 1:2,500,000 scale|h[electronic resource] :|ba digital representation of the 1974 P.B. King and H.M. Beikman map /|cU.S. Department of the Interior, U.S. Geological Survey ; by Paul G. Schruben, Raymond E. Arndt, and Walter J. Bawiec ; display software by Russell A. Ambroziak |aGeological Survey (U.S.) |aRelease 2, 1998"
"|aEcoregions of Tennessee|h[graphic] /|cUSGS ... [et al.] ; principal authors, Glenn Griffith, James Omernik, and Sandra Azevedo"
"|aMap of surficial deposits and materials in the eastern and central United States, east of 102? west longitude /|cU.S. Department of the Interior, U.S. Geological Survey ; by David S. Fullerton, Charles A. Bush, and Jean N. Pennell |aGeological Survey (U.S.)"
"|aCD-ROM atlas of the deepwater parts of the U.S. Exclusive Economic Zone in the Atlantic Ocean, the Gulf of Mexico, and the eastern Caribbean Sea|h[electronic resource] /|cby D.C. Twichell and C.F. Polloni ; display software by Russell A. Ambroziak ; software documentation by Christine A. Cook |aTwichell, David C"
|aDistrict maps of the 110th Congress|h[electronic resource] |aGeological Survey (U.S.)
|aAntarctic Region |aUnited States.|bCentral Intelligence Agency |a[Planimetric ed.]
|aNorth Korea |aUnited States.|bCentral Intelligence Agency |a[Planimetric ed.]
|aA Gap analysis of Virginia|h[electronic resource] :|bJune 2001 final report
"|aSusceptibility of major aquifers to surface contamination - Holmes, Humphreys, Issaquena, Sharkey, Washington, and Yazoo counties, Mississippi /|cU.S. Department of the Interior, U.S. Geological Survey ; by Richard S. Moreland and Charles G. O'Hara ; prepared in cooperation with the Mississippi Department of Environmental Quality, Office of Pollution Control [and] Mississippi Department of Agriculture and Commerce |aGeological Survey (U.S.)"
"|aCensus atlas of the United States :|bCensus 2000 special reports /|cU.S. Department of Commerce, Economics and Statistics Administration, U.S. Census Bureau ; [prepared by] Trudy A. Suchan ... [et al.] |aUnited States.|bBureau of the Census |aOfficial U.S. Government ed"
"|aMaps showing geology, oil and gas fields and geologic provinces of Africa|h[electronic resource] /|cU.S. Department of the Interior, U.S. Geological Survey ; by Feliks Persits ... [et al.] |aGeological Survey (U.S.)"
|aIraq|h[cartographic material] |aUnited States.|bCentral Intelligence Agency
"|aPiedmont Lake fishing map|h[cartographic material] /|cOhio Department of Natural Resources, Division of Wildlife"
|aA Gap Analysis of Tennessee|h[electronic resource] :|bJune 2006 final report
